,descripteur,disparition,envergure,espece,famille,genre,image,localisation,ordre,poids,taille,text,title,id,class_bird,french name
98,"Linnaeus, 1766",,  250 à 295 cm.,monachus,"
 ",Accipitridés,https://www.oiseaux.net/photos/denis.chavigny/images/vautour.moine.dcha.1p.jpg,,Accipitriformes,  7000 à 12500 g,  107 cm,"Chez les adultes, la tête dégarnie, chauve est de couleur gris-clair avec des replis de peau bleuâtres et des marques sombres autour des iris. Chez les juvéniles, la tête est recouverte d'un duvet brun. Le bec est brun-noir. La transition avec le corps s'effectue par un collier de plumes brun sombre qu'il arbore autour du cou. Le plumage corporel est entièrement brun sombre, les pattes sont gris clair. Les juvéniles sont encore plus sombres, ils n'éclaircissent et n'atteignent leur plumage adulte qu'à l'âge de 6 ans.",Vautour moine,272,272.Vautour_moine,Vautour moine
99,"Linnaeus, 1758",,  82 à 87 cm.,vanellus,"
 ",Charadriidés,https://www.oiseaux.net/photos/denis.chavigny/images/vanneau.huppe.dcha.0p.jpg,,Charadriiformes,  150 à 310 g,  31 cm,"L'identification du Vanneau huppé adulte ne pose pas de problème. Limicole de taille moyenne avec les parties supérieures vert sombre et le dessous blanc. Et surtout une tête noire et blanche porteuse d'une longue huppe noire dressée bien visible à l'arrière de la calotte. Le dimorphisme sexuel est faible. La huppe du mâle nuptial est plus longue et il a plus de noir à la face. Sa gorge est noire. La femelle a la face moins noire et sa gorge est blanche tachée de noir. En revanche, en plumage inter-nuptial, la distinction est beaucoup moins évidente car le noir de la tête s'estompe en partie. On note encore chez l'adulte un bandeau pectoral noir sur fond blanc très net et des sous-caudales rousses. En hiver, les tectrices supérieures vertes ont un bord beige clair qui donne au dessus un aspect écailleux. La huppe est plus courte et la tête prend une teinte un peu roussâtre. Le poussin est couvert d'un duvet cryptique gris beige taché de noir avec la nuque et le dessous blancs. Le juvénile ressemble à l'adulte mais avec un patron de tête moins marqué, une huppe courte, des parties supérieures d'un vert plus terne et mouchetées de beige chamois, un bandeau pectoral moins net.
En vol, c'est le contraste entre les parties supérieures sombres et le dessous blanc qui attire l'oeil, surtout de la part des groupes qui évoluent de façon coordonnée. Quand ils virevoltent dans le ciel comme il font souvent, on a l'impression de loin que le groupe clignote, tantôt noir quand les oiseaux tournent le dos, tantôt blanc dans le cas inverse. De près, on voit que le dessus n'est pas entièrement sombre. La base de la queue est blanche et il y a du blanc à l'extrémité de la main. En vue inférieure, l'aspect noir et blanc du corps, des ailes et de la queue est frappant. Enfin, on notera la morphologie originale de l'aile. La main est large et arrondie, un peu spatulée même, ce qui donne au Vanneau huppé une silhouette particulière en vol.",Vanneau huppé,271,271.Vanneau_huppé,Vanneau huppé
100,"Linnaeus, 1758",LC,  13 à 17 cm.,troglodytes,"
 ",Troglodytidés,https://www.oiseaux.net/photos/denis.chavigny/images/troglodyte.mignon.dcha.4p.jpg,,Passériformes,  8 à 13 g,  10 cm,"Le Troglodyte mignon est un des plus petits passereaux du vieux continent. Il mesure moins de 10 cm de longueur et ne pèse que 8 g environ. La longueur de sa main est inférieure à 5 cm. Sa silhouette est très typique. Le corps rondelet porte une tête massive prolongée par un long bec fin et légèrement courbe. Une très courte queue (3,5 cm) est le plus souvent tenue relevée. Les ailes courtes et arrondies battent très rapidement. De fortes pattes roses, toutes proportions gardées, agrippent fermement le support. Mâle et femelle sont identiques d'aspect. Le dessus est d'un brun assez chaud, nuancé par endroits de marron, particulièrement sur la queue et les sus-caudales. Un long sourcil clair surmonte l'œil sombre. Les rémiges et les rectrices apparaissent nettement barrées de brun sombre. Le dessous est beige-chamois avec les flancs eux aussi nettement barrés. Le juvénile ne se distingue des adultes que par des détails infimes de plumage invisibles sur le terrain. Aucune confusion avec une autre espèce n'est possible.",Troglodyte mignon,270,270.Troglodyte_mignon,Troglodyte mignon
101,"Wilson, A, 1810",,  - ,palustris,"
 ",Troglodytidés,https://www.oiseaux.net/photos/denis.chavigny/images/troglodyte.des.marais.dcha.1p.jpg,https://www.oiseaux.net/maps/images/troglodyte.des.marais.1.200.w.png,Passériformes,  9 à 14 g,  13 cm,"Bien qu'il soit habituellement le seul troglodyte dans son habitat spécifique, on le trouve parfois en compagnie du troglodyte à bec court. Il se distingue de ce dernier par sa plus grande taille et son bec proportionnellement plus long. Il possède aussi un sourcil bien plus proéminent, constrastant avec sa calotte brune ou noirâtre sans stries ainsi que des couvertures sous-caudales plus pâles. 
Le dessus de la tête est brun-noir uni, plus foncé sur les côtés, formant une calotte qui contraste avec le brun-olive des côtés du cou. La partie centrale du dos est noir terne avec d'évidentes stries longitudinales blanchâtres qui se poursuivent jusqu'à mi-dos et à la partie supérieure du croupion en contrastant avec les épaules, les côtés du dos et le bas du croupion qui sont brun moyen. Les primaires et les secondaires sont gris noirâtre plus foncé, avec des barres brunes peu évidentes sur les filets extérieurs. Les rectrices affichent une teinte brun moyen et des barres parallèles plus foncées, plus larges et plus évidentes sur les plumes latérales. La tête porte un large sourcil gris-brun qui tranche remarquablement avec le capuchon sombre et les couvertures auriculaires brun moyen. La gorge, la poitrine et le ventre sont gris, virant au chamois sur les côtés. La partie basse du ventre est chamoisée, devenant plus éclatante et plus sombre sur les flancs et la zone anale. Le dessous des ailes est grisâtre. Les yeux sont bruns, le bec brun foncé dessus, brun jaunâtre dessous. Les pattes sont brun pâle. 
Les jeunes sont généralement plus ternes que les adultes. Les stries sur le dos sont réduites ou absentes, le sourcil bien moins évident. Les barres de rémiges sont plus discrètes. La poitrine porte souvent une bande chamois terne.",Troglodyte des marais,197,197.Marsh_Wren,Troglodyte des marais
102,"Frivaldszky, 1838",LC,  47 à 55 cm.,decaocto,"
 ",Columbidés,https://www.oiseaux.net/photos/denis.chavigny/images/tourterelle.turque.dcha.0p.jpg,,Columbiformes,  125 à 225 g,  32 cm,"La Tourterelle turque est un petit pigeon élancé, vivant proche de l'Homme et de ses activités. Avec sa queue assez longue et ses ailes relativement courtes et arrondies, elle peut être prise au vol pour un épervier, ce qui peut mettre en émoi provisoire les petits passereaux lorsqu'elle déboule sans prévenir.
Elle a un plumage clair. Les parties supérieures (corps, couvertures alaires et rectrices centrales) sont d'un brun-chamois clair, paraissant uniforme de loin. Mais de près, on voit que certaines tectrices ont un rachis assombri et sont légèrement ourlées de pâle. Les rémiges sont brun sombre et des plumes gris clair sont visibles vers le poignet. Les parties inférieures sont sable clair. En période nuptiale, la tête, le cou et la corps se teintent légèrement de rose. Un net demi-collier noir se dessine à l'arrière du cou, parfois souligné de blanc. Les rectrices, centrales exceptées, sont bicolores, noires sur la moitié proximale, blanches sur la partie distale et cela se voit très bien en vol comme se voit très bien le dessous des ailes clair. L'iris est rouge-sang, l'œil cerclé de blanc et le bec noir. Les pattes sont rosâtres.
Le juvénile a les tectrices supérieures nettement ourlées de chamois. Le demi-collier est absent. L'iris est brun et les pattes brun rougeâtre.",Tourterelle turque,269,269.Tourterelle_turque,Tourterelle turque
103,"Linnaeus, 1758",,  47 à 53 cm.,turtur,"
 ",Columbidés,https://www.oiseaux.net/photos/denis.chavigny/images/tourterelle.des.bois.dcha.0p.jpg,,Columbiformes,  150 à 225 g,  29 cm,"Chez cette petite tourterelle, les deux sexes sont identiques. La tête et la calotte sont gris-bleu, les plumes de l'arrière du capuchon et de la nuque présentant souvent de vagues bordures brunes. Les côtés du cou portent des raies blanches et noires réparties sur 3 ou 4 rangées. Les scapulaires, le manteau et les couvertures alaires affichent une teinte marron-roux mais avec le centre des plumes noir, ce qui donne à ces parties un aspect fortement écailleux. La longue queue arrondie noire est bordée de blanc, hormis les rectrices centrales. Les rémiges gris-bleu sont particulièrement visibles en vol. Le cou et la poitrine sont gris rosâtre. Le ventre et le reste des parties inférieures sont blanchâtres, plus clairs que ceux de la Tourterelle turque. L'œil jaune est entouré d'un anneau rouge. Le bec est sombre, les pattes rosâtres. 

Les juvéniles sont plus ternes et bruns. Le gris de la tête et du cou, le violacé de la poitrine sont remplacés par du brun éteint. Les liserés chamois roux pâle sont plus étroits aux scapulaires, aux rémiges tertiaires et aux couvertures alaires. Le centre noir des plumes est moins net. Tous ces caractères rendent l'aspect écailleux moins évident. Le cercle orbital est rosé et non rouge.",Tourterelle des bois,268,268.Tourterelle_europeenne,Tourterelle des bois
104,"Linnaeus, 1758",,  20 à 28 cm.,erythrophthalmus,"
 ",Passerellidés,https://www.oiseaux.net/photos/serge.nicolle/images/tohi.a.flancs.roux.seni.1p.jpg,,Passériformes,  32 à 52 g,  21 cm,Tohi à flancs roux (Pipilo erythrophthalmus) est un oiseau qui appartient à la famille des Passerellidés.,Tohi à flancs roux,21,021.Eastern_Towhee,Tohi à flancs roux
105,"Linnaeus, 1766",,  - ,muraria,"
 ",Tichodromidés,https://www.oiseaux.net/photos/denis.chavigny/images/tichodrome.echelette.dcha.0p.jpg,https://www.oiseaux.net/maps/images/tichodrome.echelette.1.200.w.png,Passériformes,  15 à 20 g,  17 cm,"Seule espèce représentante de sa famille, le tichodrome échelette ou tichodrome des murailles (lat. : tichos : murs) est un petit oiseau montagnard aux larges ailes arrondies avec de grandes taches rouge-carmin et de gros points blancs. Dessus gris. Menton, gorge et poitrine noirs en été et blanchâtres en hiver. Long bec fin et légèrement courbe. Queue gris-noir tachetée de blanc.",Tichodrome échelette,267,267.Tichodrome_echelette,Tichodrome échelette
106,"Linnaeus, 1758",LC,  - ,spinus,"
 ",Fringillidés,https://www.oiseaux.net/photos/denis.chavigny/images/tarin.des.aulnes.dcha.2p.jpg,,Passériformes,  10 à 14 g,  12 cm,"Le Tarin des aulnes est un petit fringille de taille inférieure à celle du chardonneret. C'est un oiseau du nord de l'Europe et des montagnes du sud, hivernant commun en France. 
Le mâle adulte nuptial se reconnaît d'abord au jaune qui est partout dans son plumage, mais pas de façon uniforme. Ce jaune est particulièrement vif sur les côtés de la tête, les couvertures alaires, le croupion et la queue. Les parties inférieures sont bien jaunes aussi, et diversement striées de noirâtre suivant les individus. Certains sont bien striés sur les flancs, d'autres pas du tout, peut-être en rapport avec l'âge. Le manteau lui est plutôt olive. En vue de face, on note la calotte, le front, les lores et le menton noirs, caractère sexuel secondaire. Le bec est couleur corne, bien conique et pointu. Les pattes sont rosâtres à brunâtres.
La femelle adulte est sensiblement différente. Tout d'abord, elle n'a pas de noir à la tête. Ensuite, bien qu'ayant le même patron de plumage, elle est bien moins jaune que le mâle, plus pâle. Le jaune le plus vif est sur le croupion. Elle est bien striée de noirâtre sur la calotte, le manteau et toutes les parties inférieures. Parties nues comme le mâle.
Le juvénile est encore moins coloré et plus strié que la femelle. Le jaune n'est présent que sur les ailes (liserés des rémiges) et sur la queue. Le manteau est chamois strié de noirâtre. Les extrémités roussâtres des moyennes et grandes couvertures forment deux barres alaires bien visibles. Le bec est plus sombre.",Tarin des aulnes,266,266.Tarin_des_aulnes,Tarin des aulnes
107,"Linnaeus, 1758",,  28 à 30 cm.,rubra,"
 ",Cardinalidés,https://www.oiseaux.net/photos/serge.nicolle/images/tangara.vermillon.seni.2p.jpg,,Passériformes,  ,  18 cm,Tangara vermillon (Piranga rubra) est un oiseau qui appartient à la famille des Cardinalidés.,Tangara vermillon,140,140.Summer_Tanager,Tangara vermillon
108,"Gmelin, JF, 1789",,  25 à 29 cm.,olivacea,"
 ",Cardinalidés,https://www.oiseaux.net/photos/serge.nicolle/images/tangara.ecarlate.seni.1p.jpg,,Passériformes,  23 à 28 g,  17 cm,Tangara écarlate (Piranga olivacea) est un oiseau qui appartient à la famille des Cardinalidés.,Tangara écarlate,139,139.Scarlet_Tanager,Tangara écarlate
109,"Audubon, 1839",,  132 à 142 cm.,occidentalis,"
 ",Laridés,https://www.oiseaux.net/photos/serge.nicolle/images/goeland.d.audubon.seni.2p.jpg,,Charadriiformes,  800 à 1250 g,  66 cm,Goéland d'Audubon (Larus occidentalis) est un oiseau qui appartient à la famille des Laridés.,Goéland d'Audubon,66,066.Western_Gull,Goéland d'Audubon
110,"Gmelin, JF, 1789",,  205 à 230 cm.,minor,"
 ",Frégatidés,https://www.oiseaux.net/photos/serge.nicolle/images/fregate.du.pacifique.seni.0p.jpg,,Suliformes,  1000 à 1640 g,  105 cm,Frégate du Pacifique (Fregata minor) est un oiseau qui appartient à la famille des Frégatidés.,Frégate du Pacifique,44,044.Frigatebird,Frégate du Pacifique
111,"Linnaeus, 1758",LC,  72 à 83 cm.,hirundo,"
 ",Laridés,https://www.oiseaux.net/photos/denis.chavigny/images/sterne.pierregarin.dcha.2p.jpg,,Charadriiformes,  90 à 150 g,  39 cm,"Les sternes, parfois appelées hirondelles de mer, sont des oiseaux aux longues ailes et au vol gracieux. Leur tête est couverte d'une calotte noire tandis que le reste de leur plumage est blanc et cendré, comme les mouettes. La différence entre les espèces de sternes est assez subtile. Il faut regarder le bec, les pattes, la forme de la queue et l'allure. La Sterne pierregarin a le bec rouge terminé par une pointe noire. Ses pattes sont rouges. On veillera à ne pas confondre la Sterne pierregarin avec la Sterne arctique, plus rare, dont le bec est complètement rouge-sang et la queue plus longue et plus échancrée. Les critères de couleur du bec sont valables seulement lorsque les oiseaux sont en plumage nuptial.",Sterne pierregarin,144,144.Common_Tern,Sterne pierregarin
112,"Gambel, 1849",,  76 à 81 cm.,elegans,"
 ",Laridés,https://www.oiseaux.net/photos/denis.chavigny/images/sterne.elegante.dcha.0p.jpg,,Charadriiformes,  217 à 300 g,  43 cm,"Cette sterne de taille moyenne, a un long bec orange, une calotte noire, avec un plumage ébouriffé à la nuque. Les parties supérieures sont de couleur gris clair, et les inférieures blanches avec parfois des nuances roses sur les plumes du ventre. Les pattes sont noires. La sterne élégante a un aspect très semblable à la Sterne royale mais on peut les différencier grâce à son bec qui est plus long, plus étroit, légèrement incurvé et souvent d'un orange plus vif, et par sa huppe qui est plus hirsute. En plumage internuptial le front est blanc et elle n'a pas de cercle oculaire blanc. Les juvéniles ont le dessus plus pâle avec des motifs écailleux gris.
Quelques critères permettent de la distinguer des autres sternes proches. La crête est moins hirsute que celle de la sterne à crête. Le noir de la couronne qui descend jusqu'au niveau de l'œil le dépasse un peu en avant, créant une petite bavure noire alors que chez la Sterne royale le noir s'arrête à l'œil. Elle a une allure légèrement plus élancée et plus mince et la courbe du bec est un peu moindre que chez la sterne à crête. Elle est sensiblement plus pâle sur le dessus que la sterne à crête, avec une culotte blanche (sans gris).",Sterne élégante,145,145.Elegant_Tern,Sterne élégante
113,"Nuttall, 1834",,  73 à 82 cm.,forsteri,"
 ",Laridés,https://www.oiseaux.net/photos/barry.kent.mackay/images/sterne.de.forster.bkma.0p.jpg,,Charadriiformes,  150 à 193 g,  36 cm,Sterne de Forster (Sterna forsteri) est un oiseau qui appartient à la famille des Laridés.,Sterne de Forster,146,146.Forsters_Tern,Sterne de Forster
114,"Pallas, 1770",LC,  127 à 140 cm.,caspia,"
 ",Laridés,https://www.oiseaux.net/photos/denis.chavigny/images/sterne.caspienne.dcha.0p.jpg,,Charadriiformes,  550 à 750 g,  56 cm,"La Sterne caspienne est la plus grande des sternes. Les deux sexes sont identiques. En été, les adultes ont le manteau et les ailes gris pâle, plus foncé à l'extérieur des primaires, formant une pointe sombre sous l'aile en vol. La tête est blanche, avec le front, la calotte et la nuque noirs. Le dessous du corps et la queue sont blancs. Le bec est puissant, pointu, rouge avec le bout noir. Les pattes sont noires. 
Les juvéniles sont assez semblables aux adultes en hiver, mais avec des taches foncées d'un bout à l'autre des couvertures sur les ailes, et sur la queue. La tête a des marques sombres. Les pattes sont rose foncé.",Sterne caspienne,143,143.Caspian_Tern,Sterne caspienne
115,"Pontoppidan, 1763",LC,  76 à 85 cm.,paradisaea,"
 ",Laridés,https://www.oiseaux.net/photos/denis.chavigny/images/sterne.arctique.dcha.2p.jpg,,Charadriiformes,  80 à 120 g,  36 cm,"C'est un oiseau très proche de la Sterne pierregarin et sa différenciation est particulièrement difficile sauf dans de bonnes conditions d'observation. Toutefois, quelques critères morphologiques permettent de la distinguer, en particulier son allure générale plus ramassée en raison de sa tête plus petite et arrondie, son bec plus court, son corps assez allongé disposé sur des pattes d'une taille extrêmement modeste. Chez l'adulte nuptial, ce sont pourtant les détails physiques qui permettent de marquer la différence : des filets de queue plus longs, dépassant de peu le bout de l'aile quand elle est posée, un bec et des pattes plus courts et d'un rouge plus foncé, et surtout un dessous typiquement plus gris que celui de la plupart des sternes pierregarins. Quelques derniers détails viennent confirmer la distinction. Chez la sterne arctique, les faces latérales de la tête et les joues sont plus blanches, la calotte noire descend moins largement sur la nuque, les rémiges primaires ne portent pas les marques sombres d'usure que l'on peut constater chez son homologue pierregarin. En plumage hivernal, la sterne arctique subit trois transformations mineures : le front blanchit, la couleur du bec devient noire et les filets de la queue sont plus courts.",Sterne arctique,141,141.Artic_Tern,Sterne arctique
116,"Pallas, 1769",,  - ,psittacula,"
 ",Alcidés,https://www.oiseaux.net/photos/serge.nicolle/images/starique.perroquet.seni.2p.jpg,https://www.oiseaux.net/maps/images/starique.perroquet.1.200.w.png,Charadriiformes,  ,  25 cm,Starique perroquet (Aethia psittacula) est un oiseau qui appartient à la famille des Alcidés.,Starique perroquet,7,007.Parakeet_Auklet,Starique perroquet
117,"Pallas, 1769",,  40 à 50 cm.,cristatella,"
 ",Alcidés,https://www.oiseaux.net/photos/serge.nicolle/images/starique.cristatelle.seni.2p.jpg,https://www.oiseaux.net/maps/images/starique.cristatelle.1.200.w.png,Charadriiformes,  50 à 265 g,  20 cm,"Cet alcidé, originaire du Pacifique Nord est nettement plus grand que le Mergule nain et présente en toutes saisons un plumage tout gris fuligineux y compris au dessous de l'aile. L'iris est pâle et il possède un court bec épais. En plumage nuptial, la starique cristatelle affiche un bec et des commissures orange vif, une fine touffe de plumes blanches en arrière de l'oeil. Son caractère distinctif le plus remarquable est constitué par une huppe noire frontale bouclée vers l'avant. En hiver, son aspect général subit très peu de transformations : le bec est moins vif, la touffe de plumes blanches disparaît et la huppe est plus courte. Les juvéniles ne portent aucune plume ornementale à la tête et le bec est sombre et plus petit. 

En vol, la starique cristatelle a une apparence entièrement gris foncé ou noirâtre, ses ailes sont légèrement plus longues que celles du mergule. Il peut être confondu avec un mergule mazouté, un macareux nageant bas sur l'eau et dont le dessous blanc est masqué, ou encore avec un guillemot à miroir de la rare forme sans plage alaire blanche. Toutefois, la forme du bec doit éviter toute erreur.",Starique cristatelle,5,005.Crested_Auklet,Starique cristatelle
118,"Linnaeus, 1758",,  - ,canaria,"
 ",Fringillidés,https://www.oiseaux.net/photos/denis.chavigny/images/serin.des.canaries.dcha.1p.jpg,https://www.oiseaux.net/maps/images/serin.des.canaries.1.200.w.png,Passériformes,  15 à 20 g,  14 cm,Serin des Canaries (Serinus canaria) est un oiseau qui appartient à la famille des Fringillidés.,Serin des Canaries,265,265.Serin_des_canaries,Serin des Canaries
119,"Gmelin, SG, 1774",LC,  23 à 26 cm.,ochruros,"
 ",Muscicapidés,https://www.oiseaux.net/photos/denis.chavigny/images/id/rougequeue.noir.dcha.3p.jpg,,Passériformes,  14 à 20 g,  15 cm,"Le Rougequeue noir est un petit passereau au plumage sombre et discret, se trouvant fréquemment dans un environnement humain, mais pas exclusivement. Dans son aire très vaste, allant de l'Europe de l'Ouest à la Chine de l'Est, l'espèce présente 5 sous-espèces qui diffèrent suffisamment pour être facilement distinguées, au moins pour les mâles.
Le mâle nuptial de la ssp ""gibraltariensis"" de l'ouest de l'Europe, celle qui occupe la France, paraît tout noir de loin. En fait, de près, on voit que les parties supérieures sont d'un gris-anthracite sur lequel se détache nettement sur les ailes une zone blanchâtre constituée par les bordures externes des rémiges secondaires. C'est l'avant du corps qui est noir, front, lores, parotiques, gorge et poitrine, plus ou moins largement suivant les individus. Sur ce fond noir, l'œil très sombre ne ressort pas du tout. Souvent un peu de blanchâtre est visible en arrière du front noir. Le ventre présente un dégradé de gris de l'avant vers l'arrière. Tout l'arrière du corps, croupion et sus-caudales, bas ventre et sous-caudales, est orange vif. La queue est d'un brun-gris sombre au niveau des rectrices centrales tandis que les rectrices externes sont orange, l'ensemble étant typique de la plupart des espèces de rougequeues et bien visible à l'envol. Bec et pattes sont noirs.
Le plumage nuptial complet n'est acquis qu'à l'âge de deux ans. Les mâles d'un an sont plus gris, moins noirs et souvent ne présentent pas de zone claire sur l'aile. Ils peuvent ainsi être pris pour des femelles. Malgré cela, ils sont capables de se reproduire. 
La femelle est d'un gris-souris, nuancé de brun sur les parotiques et avec les ailes plus sombres sans zone pâle.
Le dessous est d'un gris-beige parfois nuancé de fauve. La queue est identique à celle du mâle. Les sous-caudales sont orange pâle.
Le juvénile ressemble à la femelle, mais il est plus sombre dessus comme dessous. Les premiers temps, les commissures jaunes attestent du jeune âge.
Les sous-espèces se différencient à l'importance de la couleur orange des parties inférieures du mâle. Il y a une variation clinale entre la sous-espèce occidentale ""gibraltariensis"" chez laquelle seuls le bas-ventre et les sous-caudales sont orange, et la ssp la plus orientale ""rufiventris"" chez laquelle la totalité du ventre et le bas de la poitrine sont orange, ce qui est déroutant pour un européen. Même variation pour la couleur du manteau et des couvertures qui passe de gris sombre à l'ouest au noir à l'est. De son côté, la zone pâle de l'aile a tendance à s'atténuer d'ouest en est, pour disparaître chez rufiventris. Le mâle de la ssp asiatique ""phoenicuroides"" est troublant, comme son nom le laisse entendre. Dépourvu de zone pâle sur l'aile et montrant une tache pâle en arrière du front noir, il évoque le Rougequeue à front blanc mâle, ou encore un mâle hybride ochruros x phoenicurus.",Rougequeue noir,264,264.Rougequeue_noir,Rougequeue noir
