,descripteur,disparition,envergure,espece,famille,genre,image,localisation,ordre,poids,taille,text,title,id,class_bird,french name
201,"Linnaeus, 1758",LC,  18 à 25 cm.,hyemalis,"
 ",Passerellidés,https://www.oiseaux.net/photos/denis.chavigny/images/junco.ardoise.dcha.0p.jpg,https://www.oiseaux.net/maps/images/junco.ardoise.1.200.w.png,Passériformes,  18 à 30 g,  17 cm,"Le junco ardoisé est un passereau svelte et de petite taille. Le mâle adulte présente une tête, des parties supérieures, une gorge, une poitrine et des flancs entièrement gris-ardoise, parfois avec une légère nuance brune sur le manteau. Les ailes sont noirâtres avec des liserés grisâtres particulièrement visibles sur les grandes couvertures et sur les tertiaires. La queue est noirâtre avec les rectrices extérieures entièrement ou partiellement blanches. Le ventre et les sous-caudales sont blancs, contrastant avec les flancs et la poitrine gris-ardoise. L'iris est brun sombre, le bec rose clair. Les pattes sont brun sombre ou chair grisâtre. Pendant toute l'année, le plumage ne subit aucune modification mais la pointe du bec peut être légèrement plus sombre en dehors de la période nuptiale. Chez la femelle, le plumage affiche les mêmes motifs mais le capuchon et les parties supérieures sont gris plus pâle. Le manteau affiche une nuance nettement plus brune. Les liserés des ailes sont également plus bruns, en particulier sur les tertiaires. La queue présente moins de blanc. 

Les juvéniles affichent un ensemble assez semblable à celui de la femelle. Il peut y avoir d'assez grosses différences entre les différentes races.",Junco ardoisé,76,076.Dark_eyed_Junco,Junco ardoisé
202,"Vieillot, 1808",,  22 à 30 cm.,cedrorum,"
 ",Bombycillidés,https://www.oiseaux.net/photos/denis.chavigny/images/jaseur.d.amerique.dcha.0p.jpg,https://www.oiseaux.net/maps/images/jaseur.d.amerique.1.200.w.png,Passériformes,  ,  15 cm,Jaseur d'Amérique (Bombycilla cedrorum) est un oiseau qui appartient à la famille des Bombycillidés.,Jaseur d'Amérique,186,186.Cedar_Waxwing,Jaseur d'Amérique
203,"Linnaeus, 1758",LC,  34 à 35 cm.,garrulus,"
 ",Bombycillidés,https://www.oiseaux.net/photos/denis.chavigny/images/jaseur.boreal.dcha.1p.jpg,,Passériformes,  40 à 64 g,  23 cm,"Le Jaseur boréal a un peu la taille, la silhouette et le vol de l'Etourneau sansonnet avec lequel, en Europe, on peut le confondre de loin si on ne fait pas attention, d'autant plus qu'il est grégaire comme lui, mais une observation attentive nous ramène vite à la raison. Le plumage est clair et le bec court. 
Ce qui saute aux yeux de prime abord, c'est la longue huppe érectile fréquemment dressée sur la tête. La face est très contrastée. Un bandeau noir partant du front englobe l'œil sombre et se poursuit vers la nuque. Noire également est la gorge. L'avant de la calotte et des joues est roux. Une tache blanche s'observe à la commissure buccale et un trait blanc souligne l'œil. Le bec bicolore est plutôt court et épais. 
Le manteau et les couvertures alaires sont brun-beige passant au gris clair sur le dos, le croupion et les sus-caudales. Le dessous est beige, légèrement teinté de saumon au cou et à la poitrine. Le bas-ventre blanc contraste vivement avec les sous-caudales châtain.
Ailes et queue sont remarquables. Les rémiges primaires noires sont terminées de blanc et de jaune. Les rémiges secondaires grises à bout blanc sont prolongées par un pinceau cireux rouge vif. Une bande blanche barre l'aile au niveau des grandes couvertures. La courte queue, grise à la base puis noire, est terminée de jaune, comme si l'oiseau avait trempé ses rectrices dans un pot de peinture.
Le dimorphisme sexuel est léger. La femelle a moins de jaune au bout de la queue, moins de blanc aux rémiges primaires, moins de rouge aux secondaires, le noir de la gorge moins bien délimité, etc.
Le juvénile a un plumage beaucoup plus terne, plus gris, sans les subtiles nuances roses ou rousses qui caractérisent celui de l'adulte. De plus, il est moins uniforme, strié de brun sur les parties inférieures. La gorge est blanche. Le masque facial plus étroit, la huppe moins longue, le jaune de l'aile plus pâle, celui de la queue moins large que chez l'adulte. Mais tout cela ne se voit que sur les lieux de reproduction, avant la mue post-juvénile. Après la première mue, le jeune devient assez semblable à l'adulte mais son plumage manque de brillance. Il se reconnaît surtout à ses rémiges primaires dont le jaune du vexille externe est moins développé et plus pâle et le blanc du vexille interne absent. C'est assez subtil.",Jaseur boréal,185,185.Bohemian_Waxwing,Jaseur boréal
204,,,,,,,https://www.oiseaux.net/photos/lars.petersson/images/id/inseparable.de.fischer.lape.1p.152.h.jpg,,,,,Inséparable de Fischer (Agapornis fischeri) est un oiseau qui appartient à la famille des Psittaculidés.,Inséparable de Fischer,242,242.Inseparables_de_fischer,Inséparable de Fischer
205,"Linnaeus, 1758",LC,  42 à 46 cm.,epops,"
 ",Upupidés,https://www.oiseaux.net/photos/john.gould/images/id/huppe.fasciee.jogo.0p.jpg,,Bucérotiformes,  55 à 80 g,  32 cm,"Une huppe se reconnaît au premier coup d'œil. L'allure générale, la couleur rousse du plumage, les ailes et la queue noires et blanches, la grande huppe érectile qui orne la tête et le long bec courbe en font un oiseau remarquable. Les trois espèces de huppes se ressemblent beaucoup et leurs différences sont subtiles. 
La Huppe fasciée se distingue à sa main noire barrée de blanc (toute noire chez son homologue du sud de l'Afrique) et à la zone blanche sub-terminale des plumes de sa huppe.
Autrement, il n'est qu'à regarder une photo pour se faire une idée de l'oiseau. Cela ne nécessite pas une longue description. Sur l'oiseau posé, on distingue surtout la huppe rousse souvent hérissée, la tête, le cou et le manteau couleur sable chaud, la partie visible de l'aile noire barrée de blanc et le long bec gris courbe. Lorsque l'oiseau est en vol, ce sont surtout les ailes larges et arrondies, noires et barrées de blanc qui attirent l'attention ainsi que leurs battements particuliers.
Il n'y a pas de dimorphisme sexuel net. La femelle est simplement un peu plus petite et plus pâle.
Le juvénile ressemble à la femelle en plus terne, avec la huppe et le bec plus courts.",Huppe fasciée,241,241.Huppe_fasciee,Huppe fasciée
206,"Linnaeus, 1758",LC,  32 à 34 cm.,rustica,"
 ",Hirundinidés,https://www.oiseaux.net/photos/denis.chavigny/images/hirondelle.rustique.dcha.0p.jpg,,Passériformes,  16 à 25 g,  18 cm,"Avec son corps fuselé, ses ailes en faucille, sa queue fourchue et sa vaste répartition, l'Hirondelle rustique peut être prise comme modèle de la famille des Hirundinidés. 
L'adulte en plumage nuptial a le dessus du corps et les couvertures alaires noirâtres à reflets bleutés à bonne lumière. Rémiges et rectrices sont plus brunes et sans reflet. Chez la sous-espèce type ""rustica"", le dessous du corps est blanc teinté de crème. La tête montre un front et une gorge couleur brique typiques.
Ses côtés noirs enserrent la gorge, incluent l'œil sombre et se prolongent en un bandeau pectoral noirâtre plus ou moins régulier qui peut inclure quelques plumes marron. La queue est pourvue de rectrices noirâtres à large tache subterminale blanche. Leur taille augmente légèrement de l'intérieur vers l'extérieur, d'où un aspect fourchu. Les rectrices externes s'allongent tout en s'amincissant pour former deux ""filets"" étroits. Le bec noir, petit mais large, donne accès à une large cavité buccale. Les pattes très courtes sont noirâtres.
Le dimorphisme sexuel est très faible. La femelle adulte se distingue du mâle à ses ""filets"" plus courts et son plumage est un peu moins brillant.
Le juvénile est reconnaissable à son front et sa gorge de couleur fauve rosée et à l'absence de filets à la queue.
L'espèce ne peut être confondue avec une autre hirondelle dans la majeure partie de son aire. En Asie du Sud-Est, il faut faire attention à l'Hirondelle de Tahiti, assez similaire, et dans une moindre mesure à l'Hirondelle à longs brins. En revanche en Afrique où elle hiverne, 3 ou 4 espèces présentent des similitudes.
Les 8 sous-espèces décrites diffèrent entre elles par la couleur des parties inférieures qui peut aller jusqu'à un roux-châtain assez prononcé, par exemple chez les sous-espèces erythrogaster d'Amérique du Nord ou savignii d'Égypte. L'importance du collier pectoral varie également beaucoup suivant les ssp. Il va en s'amincissant d'ouest en est et peut aller jusqu'au bandeau incomplet, avec une ébauche seulement sur les côtés de la poitrine comme dans la ssp saturata de l'est de la Russie.",Hirondelle rustique,136,136.Barn_Swallow,Hirondelle rustique
207,"Linnaeus, 1758",LC,  32 à 34 cm.,rustica,"
 ",Hirundinidés,https://www.oiseaux.net/photos/denis.chavigny/images/hirondelle.rustique.dcha.0p.jpg,,Passériformes,  16 à 25 g,  18 cm,"Avec son corps fuselé, ses ailes en faucille, sa queue fourchue et sa vaste répartition, l'Hirondelle rustique peut être prise comme modèle de la famille des Hirundinidés. 
L'adulte en plumage nuptial a le dessus du corps et les couvertures alaires noirâtres à reflets bleutés à bonne lumière. Rémiges et rectrices sont plus brunes et sans reflet. Chez la sous-espèce type ""rustica"", le dessous du corps est blanc teinté de crème. La tête montre un front et une gorge couleur brique typiques.
Ses côtés noirs enserrent la gorge, incluent l'œil sombre et se prolongent en un bandeau pectoral noirâtre plus ou moins régulier qui peut inclure quelques plumes marron. La queue est pourvue de rectrices noirâtres à large tache subterminale blanche. Leur taille augmente légèrement de l'intérieur vers l'extérieur, d'où un aspect fourchu. Les rectrices externes s'allongent tout en s'amincissant pour former deux ""filets"" étroits. Le bec noir, petit mais large, donne accès à une large cavité buccale. Les pattes très courtes sont noirâtres.
Le dimorphisme sexuel est très faible. La femelle adulte se distingue du mâle à ses ""filets"" plus courts et son plumage est un peu moins brillant.
Le juvénile est reconnaissable à son front et sa gorge de couleur fauve rosée et à l'absence de filets à la queue.
L'espèce ne peut être confondue avec une autre hirondelle dans la majeure partie de son aire. En Asie du Sud-Est, il faut faire attention à l'Hirondelle de Tahiti, assez similaire, et dans une moindre mesure à l'Hirondelle à longs brins. En revanche en Afrique où elle hiverne, 3 ou 4 espèces présentent des similitudes.
Les 8 sous-espèces décrites diffèrent entre elles par la couleur des parties inférieures qui peut aller jusqu'à un roux-châtain assez prononcé, par exemple chez les sous-espèces erythrogaster d'Amérique du Nord ou savignii d'Égypte. L'importance du collier pectoral varie également beaucoup suivant les ssp. Il va en s'amincissant d'ouest en est et peut aller jusqu'au bandeau incomplet, avec une ébauche seulement sur les côtés de la poitrine comme dans la ssp saturata de l'est de la Russie.",Hirondelle rustique,240,240.Hirondelle_rustique,Hirondelle rustique
208,"Linnaeus, 1758",,  30 cm.,riparia,"
 ",Hirundinidés,https://www.oiseaux.net/photos/denis.chavigny/images/hirondelle.de.rivage.dcha.0p.jpg,,Passériformes,  12 à 18 g,  12 cm,"L'hirondelle de rivage est la seule hirondelle à dos brun. Plus petite que sa cousine rustique, on la distingue facilement par sa courte queue à peine échancrée et sa bande pectorale d'un brun cendré qui contraste avec sa gorge et son dessous blancs.",Hirondelle de rivage,135,135.Bank_Swallow,Hirondelle de rivage
209,"Vieillot, 1808",,  30 à 35 cm.,bicolor,"
 ",Hirundinidés,https://www.oiseaux.net/photos/denis.chavigny/images/hirondelle.bicolore.dcha.0p.jpg,,Passériformes,  16 à 25 g,  14 cm,Hirondelle bicolore (Tachycineta bicolor) est un oiseau qui appartient à la famille des Hirundinidés.,Hirondelle bicolore,138,138.Tree_Swallow,Hirondelle bicolore
210,"Vieillot, 1817",LC,  - ,pyrrhonota,"
 ",Hirundinidés,https://www.oiseaux.net/photos/denis.chavigny/images/hirondelle.a.front.blanc.dcha.0p.jpg,https://www.oiseaux.net/maps/images/hirondelle.a.front.blanc.1.200.w.png,Passériformes,  17 à 26 g,  15 cm,"Les hirondelles à front blanc sont des oiseaux de petite taille. Leur front varie du blanc terne au brun pâle couleur bois et s'éclaircit considérablement avec l'usure. Le capuchon est bleu-noir brillant, l'arrière du cou est gris-brun. Le manteau, le dos et les scapulaires sont bleu-noir brillant avec des stries blanches ou gris pâle sur le premier cité. Le croupion est roux-cannelle pâle. Les couvertures sus-caudales sont gris-brun avec de légères bordures claires. Les lores sont noirâtres. Les couvertures auriculaires, les côtés de la tête, le menton et la gorge forment un ensemble châtain. On peut apercevoir sur la gorge une tache noir brillant qui se poursuit jusqu'au haut de la poitrine. Le haut de la poitrine, les côtés du corps et les flancs sont gris-brun pâle avec une légère teinte châtain dans la région pectorale. Le reste des parties inférieures est blanchâtre. Les sous-caudales les plus longues sont sombres ou gris-brun foncé. Le dessous des ailes et les axillaires sont gris-brun pâle. Les couvertures alaires, les ailes et la queue affichent une couleur brun noirâtre, les couvertures, les secondaires et les tertiaires ayant des liserés très clairs, presque blancs à la pointe.
Le bec est noir, les iris bruns. Les pattes et les pieds sont couleur corne. Les sexes sont identiques. Les juvéniles sont plus ternes que les adultes. La tête, le manteau et les scapulaires sont noirâtres avec un très léger lustre. Le front est châtain, les côtés de la tête, le menton et la gorge sont recouverts d'un mélange de gris-brun, de gris sombre et de châtain terne. Les parties inférieures sont teintées de rosâtre ou de chamois vineux. Les plumes des parties supérieures ont des bordures terminales claires et les tertiaires ont des liserés vineux-cannelle.La tête présente des couleurs variables et un albinisme partiel n'est pas rare.",Hirondelle à front blanc,137,137.Cliff_Swallow,Hirondelle à front blanc
211,"Linnaeus, 1758",LC,  90 à 100 cm.,otus,"
 ",Strigidés,https://www.oiseaux.net/photos/denis.chavigny/images/hibou.moyen-duc.dcha.2p.jpg,,Strigiformes,  260 à 435 g,  35 à 40 cm,"Le Hibou moyen-duc est un hibou de taille moyenne (une 40e de cm de longueur pour une envergure d'un mètre environ et un poids de 3 à 400 g). Son plumage très cryptique est pratiquement le même quels que soient l'âge et le sexe. Le mâle est en moyenne un peu plus pâle que la femelle mais la différence de taille entre les deux n'est pas flagrante.
Les parties supérieures montrent un mélange très subtil de gris et de roux avec des vermiculures noirâtres et sont très mimétiques avec les troncs et les branches des arbres de son habitat arboré. Les ailes et la queue, grises et rousses, sont barrées de noirâtre. Une rangée de taches blanches est visible de chaque côté au niveau des scapulaires, qui augmente encore l'aspect cryptique. Chaque tectrice montre un dessin d'une extrême finesse. Les parties inférieures pâles, crème à roussâtres, sont nettement striées de noirâtre en ""arêtes de poisson"". Il y a une assez grande variabilité dans l'intensité des teintes et des dessins, à la fois inter-individuelle au sein d'une sous-espèce et entre les 4 sous-espèces actuellement reconnues. Les ""wilsonianus"" d'Amérique du Nord sont les plus sombres.
La face est remarquable. Le disque facial roux d'aspect arrondi est bordé sur les côtés de noir et de blanc. En son centre, deux larges arcs de cercles blancs forment comme un V ou un X d'où émerge la pointe du bec noirâtre et dont les concavités bordées de noir mettent en valeur les yeux jaunes à orange. Au-dessus du disque facial se dressent deux longues touffes de plumes noires, avec un peu de blanc et de roux, qui forment comme des ""oreilles"" ou des ""cornes"". C'est cette caractéristique qui a donné à l'espèce son nom anglais de ""Long-eared Owl"". Ces ""aigrettes"" sont la plupart du temps dressées et très visibles lorsque l'oiseau est posé. En revanche, en vol, l'oiseau les rabat sur les côtés et elles ne sont plus visibles. C'est dans ces circonstances que le moyen-duc peut être confondu avec le Hibou des marais car les deux ont le dessous des ailes pâle avec les poignets noirs. Ce dernier est globalement plus pâle, en particulier au niveau du disque facial, a le ventre sans marques et un vol beaucoup plus souple dû à des ailes plus longues.
Lorsqu'il est dérangé de jour, le moyen-duc affine son corps, rétrécit son disque facial en fermant partiellement les yeux qui scrutent l'intrus.
Les pattes sont nettement emplumées jusqu'aux doigts d'un plumage feutré crème ou roux.
Le poussin est couvert d'un duvet gris clair et a la face noire.",Hibou moyen-duc,239,239.Hibou_moyen_duc,Hibou moyen-duc
212,"Linnaeus, 1758",LC,  175 à 195 cm.,cinerea,"
 ",Ardéidés,https://www.oiseaux.net/photos/denis.chavigny/images/heron.cendre.dcha.0p.jpg,,Pélécaniformes,  600 à 1200 g,  98 cm,"Le Héron cendré est un de nos plus grands Ardéidés, le plus grand d'Europe. On le reconnaît justement à sa grande taille, à sa teinte grise et, au vol, à sa silhouette particulière.
Le plumage est gris moyen sur les parties supérieures et blanc dessous. Les plumes de vol, rémiges et rectrices, sont noirâtres, d'où un contraste typique entre elles et le reste du corps qui se voit bien en vol.
Le plumage gagne en netteté chez l'adulte. Les bords de la calotte deviennent bien noirs et se prolongent en petite huppe. Le bec jaunit, le devant du cou égrène de nettes stries noires, une tache blanche apparaît au poignet au-dessus des petites couvertures noires, les scapulaires s'allongent, les pattes s'éclaircissent. C'est ce plumage qui prévaut une grande partie de l'année, mais dans le courant de l'hiver, le plumage nuptial va se développer chez l'adulte reproducteur.
Le bec devient jaune orange, les lores bleuissent, la huppe noire s'allonge, de longues plumes ornementales poussent au bas du cou et au niveau des scapulaires, les pattes jaunissent encore. Le mâle se distingue alors de la femelle par ses teintes plus vives. Tous ces atours contribueront à la mise en valeur de l'adulte au moment des parades nuptiales. 
Le juvénile et l'immature ont un plumage qui ressemble à celui de l'adulte inter-nuptial, mais plus terne, avec la partie supérieure du bec et les pattes sombres.",Héron cendré,238,238.Heron_cendre,Héron cendré
213,"Linnaeus, 1758",,  70 à 86 cm.,serrator,"
 ",Anatidés,https://www.oiseaux.net/photos/denis.chavigny/images/harle.huppe.dcha.1p.jpg,,Ansériformes,  1000 à 1250 g,  58 cm,"Le harle huppé est un canard plongeur. Son bec effilé rouge, sa tête noire avec des reflets verts, son collier blanc et sa huppe lui confèrent un style inimitable. Le mâle est facile à reconnaître avec sa double huppe, son collier blanc et sa poitrine roussâtre tachetée de noir. Par contre, les femelles et les juvéniles ressemblent fortement à ceux du Harle bièvre. Cependant, l'observateur chevronné fera sans peine la distinction entre les deux espèces. En effet, les harles bièvres femelles et juvéniles présentent une très nette séparation entre la tête brune et le cou blanc alors que les femelles et les juvéniles de harle huppé voient le brun de la tête se fondre sans transition dans le gris du cou.
 Le harle tient son nom de son habitude à nager le corps submergé (Mergus, de mergere, submerger).",Harle huppé,90,090.Red_breasted_Merganser,Harle huppé
214,"Linnaeus, 1758",,  56 à 70 cm.,cucullatus,"
 ",Anatidés,https://www.oiseaux.net/photos/denis.chavigny/images/harle.couronne.dcha.0p.jpg,https://www.oiseaux.net/maps/images/harle.couronne.1.200.w.png,Ansériformes,  453 à 879 g,  50 cm,"Le Harle couronné est le plus petit des harles nord-américains, approximativement de la taille d'un Canard carolin. Le mâle possède un plumage qui présente une étonnante combinaison de noir, de blanc et de brun-roux. La tête, le cou et le manteau sont noirs, le croupion gris. La queue est brun-gris sombre. La gorge, la poitrine et le ventre sont blancs. Deux barres irrégulières noires marquent les côtés de la poitrine. Les flancs sont fauves ou brun-roux. Chez le mâle, le caractère physique le plus remarquable est constitué par la crête qui, lorsqu'elle est déployée, révèle un formidable éventail blanc bordé de noir. Quand elle est au repos, elle se réduit à une simple et large rayure blanche en arrière de l'œil. Femelles et immatures sont quasiment semblables. Ils ont des teintes sombres, gris-brun ou brun noirâtre. Le cou, la poitrine et les flancs sont gris, la tête brune. La crête de la femelle est brune avec un soupçon de cannelle et parfois de blanc à la pointe. Les immatures ont une crête similaire, mais de taille plus modeste. Tous les immatures mâles ne sont pas forcément pourvus d'un crête",Harle couronné,89,089.Hooded_Merganser,Harle couronné
215,"Linnaeus, 1758",,  28 cm.,caerulea,"
 ",Cardinalidés,https://www.oiseaux.net/photos/serge.nicolle/images/guiraca.bleu.seni.0p.jpg,,Passériformes,  26 à 31 g,  19 cm,Guiraca bleu (Passerina caerulea) est un oiseau qui appartient à la famille des Cardinalidés.,Guiraca bleu,54,054.Blue_Grosbeak,Guiraca bleu
216,"Pallas, 1811",,  - ,columba,"
 ",Alcidés,https://www.oiseaux.net/photos/serge.nicolle/images/guillemot.colombin.seni.1p.jpg,https://www.oiseaux.net/maps/images/guillemot.colombin.1.200.w.png,Charadriiformes,  450 à 550 g,  37 cm,Guillemot colombin (Cepphus columba) est un oiseau qui appartient à la famille des Alcidés.,Guillemot colombin,58,058.Pigeon_Guillemot,Guillemot colombin
217,"Linnaeus, 1758",LC,  57 à 65 cm.,niger,"
 ",Laridés,https://www.oiseaux.net/photos/denis.chavigny/images/guifette.noire.dcha.1p.jpg,,Charadriiformes,  50 à 75 g,  28 cm,"En plumage nuptial, c'est un oiseau dont le manteau et les couvertures gris noirâtre contrastent avec la tête et le dessous plus sombres, semblant presque noirs. Le dessous de l'aile est gris pâle, le bas-ventre blanc frappant. Le bec est noir, les pattes rougeâtres. Comparée à la Guifette leucoptère, cette dernière a une tête et un corps bien plus noirs, un arrière de corps plus blanc et des couvertures sous-alaires d'un noir pur. L'individu internuptial subit quelques transformations : le dessous est blanc contrastant particulièrement avec le dessus gris sombre, y compris la queue et le croupion Une tache sombre typique marque les côtés de la poitrine.",Guifette noire,142,142.Black_Tern,Guifette noire
218,"Linnaeus, 1758",LC,  180 à 200 cm.,grus,"
 ",Gruidés,https://www.oiseaux.net/photos/denis.chavigny/images/grue.cendree.dcha.2p.jpg,,Gruiformes,  4000 à 7000 g,  115 cm,"La grue cendrée a le plumage gris ardoisé, avec des plumes noires ou noir bleuâtre sur les primaires et les secondaires. On peut voir une tache rouge, un morceau de peau nue au sommet de la calotte. Le haut du cou, la gorge, le front et la nuque sont noirs. Une tache blanche démarre des yeux et s'étend jusque vers l'arrière du cou. 
Le long bec est gris avec un peu de rougeâtre à la base. Les yeux sont rouges. Les longues pattes et les doigts sont noirs. On distingue trois longs doigts, le quatrième est insignifiant. 
Les deux sexes sont semblables.
Le juvénile est légèrement plus petit que les adultes. Il a la tête emplumée de couleur châtain clair. 

 Mythologie - Symboles : Pour les Egyptiens, les grues allaient combattre, aux sources du Nil, les pygmées, ""sortes de petits hommes"", dit Aristote, ""montés sur de petits chevaux, et qui habitent des cavernes"".
 D'après les Grecs, les grues se mettent un caillou dans le bec, lorsqu'elles traversent le mont Taurus, pour s'obliger à rester muettes, et éviter d'éveiller l'attention des aigles.
 La grue passe encore pour avoir dévoilé à Palamède plusieurs caractères de l'alphabet. Ce serait, dit-on en examinant les invariables dispositions du vol des grues, que ce judicieux observateur aurait imaginé les lettres V et Y ; d'où le nom  d'oiseau de Palamède, donné en Grèce.",Grue cendrée,237,237.Grue_cendrée,Grue cendrée
219,"Cooper, W, 1825",,  30 à 36 cm.,vespertina,"
 ",Fringillidés,https://www.oiseaux.net/photos/denis.chavigny/images/grosbec.errant.dcha.0p.jpg,,Passériformes,  53 à 74 g,  22 cm,Grosbec errant (Hesperiphona vespertina) est un oiseau qui appartient à la famille des Fringillidés.,Grosbec errant,55,055.Evening_Grosbeak,Grosbec errant
