,descripteur,disparition,envergure,espece,famille,genre,image,localisation,ordre,poids,taille,text,title,id,class_bird,french name
0,"Linnaeus, 1758",LC,  113 à 128 cm.,buteo,"
 ",Accipitridés,https://www.oiseaux.net/photos/denis.chavigny/images/buse.variable.dcha.3p.jpg,,Accipitriformes,  625 à 1364 g,  57 cm,"La Buse variable, comme son nom l'indique, a un plumage extrêmement variable. Cela peut aller d'un blanc presque pur à un brun sombre quasi uniforme, avec tous les intermédiaires possibles et imaginables. C'est très déroutant pour un ornithologue débutant. Mais heureusement, dans la majorité des cas, l'oiseau est d'un brun moyen avec des caractéristiques spécifiques que je vais décrire, mais il faut bien avoir en tête que les variantes sont nombreuses. Il est admis que les oiseaux du nord de l'aire sont plus pâles que ceux du sud.
La silhouette est massive, particulièrement chez la femelle, plus grande et plus robuste que le mâle. La pointe des ailes fermées atteint à peu près l'extrêmité de la queue. La tête est assez grosse, faisant paraître le cou engoncé dans les épaules.
Le plumage adulte se caractérise par une relative uniformité des parties supérieures. Les tectrices et les couvertures alaires sont brunes, sans bordure marquée et souvent avec un trait sombre le long du rachis. Les rémiges sont, pour ce qu'on en voit sur l'aile fermée, d'un brun plus sombre, presque noirâtre quelquefois. La tête présente souvent un sourcil pâle et une sorte de moustache brune oblique sous l'œil. En moyenne, les parties inférieures se présentent comme suit. La gorge est blanche, striée de brun, et le haut de la poitrine brun tacheté de blanc formant plastron. Sous le plastron, un bandeau pectoral blanc plus ou moins taché de brun est nettement perceptible. Le ventre est brun, plus sombre et moins taché que la poitrine, souvent plus clair en son centre. Les culottes sont brunes elles aussi, plutôt unies à l'extérieur et d'aspect barré vers l'intérieur. La teinte de fond de la queue est pâle, blanchâtre à beige clair, mais les rectrices sont nettement barrées de brun, ce qui la fait paraître assez sombre. D'habitude, elle est un peu plus pâle à la base qu'à son extrémité. Cela vient du fait que les barres des rectrices sont plus étroites à la base et que la queue se termine par une large barre brune. L'iris est brun-noisette. Le bec est noir avec la cire bien jaune portant les narines arrondies. Les pattes (pied et tarse) sont du même jaune que la cire.
Le plumage juvénile est plus clair et moins uniforme que celui de l'adulte. Les plumes de couverture sont ourlées de clair et donnent au dessus un aspect écailleux. L'iris est jaune pâle et la cire est d'un jaune moins vif.
Au vol, la silhouette de la Buse variable est assez typique. C'est l'aspect compact qui frappe. La tête est grosse et sans cou apparent. Les ailes sont moyennement longues, moins que chez d'autres buses, larges sur toute leur longueur et terminées par 5 doigts noirs bien visibles. La queue est assez courte, moins longue que la largeur de l'aile dans une proportion de 0,8 environ.
Le dessous de l'aile est contrasté. Les couvertures sous-alaires brunes contrastent fortement avec les rémiges très pâles, blanchâtres et comme lustrées, même chez les oiseaux sombres. Chez ces derniers, c'est la main la zone la plus pâle. Les rémiges et les rectrices sont barrées régulièrement de brun. Chez l'adulte, rémiges et rectrices sont largement terminées de brun, ce qui donne un bord de fuite sombre bien net aux ailes et à la queue et qui n'est pas le cas chez le jeune oiseau. Ce dernier apparaît aussi plus svelte, plus pâle, souvent avec une virgule sombre au poignet chez les sujets les plus clairs.
En vue de dessus, il faut noter l'uniformité du plumage, en particulier sans zone vraiment plus pâle au niveau de la main, ce qui la distingue d'autres buses. Les sus-caudales sont en général la partie la plus claire dessus.",Buse variable,209,209.Buse_variable,Buse variable
1,"Linnaeus, 1758",,  - ,erithacus,"
 ",Psittacidés,https://www.oiseaux.net/photos/john.gerrard.keulemans/images/perroquet.jaco.jgke.0p.jpg,,Psittaciformes,  400 à 490 g,  39 cm,"Chez le perroquet jaco, la peau nue faciale qui recouvre le pourtour de l'œil est blanchâtre. La tête écaillée de blanc sur un fond gris se poursuit jusqu'au gris foncé du dos et de la poitrine avec lesquels elle se confond. Les ailes sont gris moyen, les primaires gris noirâtre. Les rectrices et les couvertures sus-caudales sont rouge écarlate brillant. Le bec et les pattes varient du gris au brun noirâtre. Les iris sont jaunâtres. Les sexes sont identiques, mais les mâles acquièrent leur teinte grise définitive un peu après les femelles. Les oiseaux assez âgés peuvent acquérir un nombre plus ou moins variable de plumes écaillées. Des oiseaux albinos ont été parfois signalés.
La taille, notamment celle du bec, peut être variable selon les individus. Ce phénomène est indépendant de l'âge, de même que l'intensité du gris et l'apport de rouge qui peut se développer jusqu'au ventre, ce qui arrive souvent chez les immatures. 

Les immatures ont du rouge foncé sur l'extrémité des rectrices rouges. Ils ont des iris gris. 

Le perroquet gris peut être confondu avec le perroquet Timneh, espèce dont il est récemment issu. Psittacus erithacus erithacus, la race nominale du perroquet gris, a un plumage gris clair, une queue rouge-cerise et un bec noir. Psittacus timneh se distingue par un plumage gris plus foncé et une queue marron foncé bordée de brunâtre, la mandibule supérieure est rougeâtre avec une pointe noire. Le limite de séparation entre les 2 espèces se fait au niveau de la Côte d'Ivoire. 
Par contre, la race nominale du perroquet gris a des différences peu marquées avec sa sous-espèce qui réside sur l'île de Principe.",Perroquet jaco,235,235.Gris_du_gabon,Perroquet jaco
2,,,,,,,,,,,,Viréo à tête noire (Vireo atricapilla) est un oiseau qui appartient à la famille des Viréonidés.,Viréo à tête noire,151,151.Black_capped_Vireo,Viréo à tête noire
3,"Gmelin, JF, 1789",LC,  30 cm.,bonariensis,"
 ",Ictéridés,https://www.oiseaux.net/photos/denis.chavigny/images/vacher.luisant.dcha.0p.jpg,,Passériformes,  31 à 63 g,  22 cm,"Le Vacher luisant fait partie des ""Blackbirds"" américains, ainsi nommés car le plumage des mâles est majoritairement ou totalement noir. C'est un blackbird de taille moyenne, à peu près celle de l'Étourneau sansonnet, mais il est plus élancé que ce dernier. Le mâle apparaît entièrement noir. Cependant, sous un bon éclairage, son plumage présente des reflets bleu-violet-pourpre sur tout le corps et souvent vert-bronze sur les ailes et la queue. La femelle est d'un brun assez uniforme avec le dessous légèrement plus clair. Un léger sourcil pâle se remarque à la tête. Le juvénile ressemble à la femelle mais son plumage est moins uniforme, légèrement strié dessus et dessous et souvent avec une nuance jaunâtre. À tous âges, l'œil est brun sombre, les pattes et le bec gris-noirâtre. Le bec conique et pointu est plus fin que celui des autres espèces de vachers. Les 7 sous-espèces reconnues diffèrent par la taille, l'intensité des reflets du plumage des mâles et la tonalité du brun de celui des femelles. Certaines femelles peuvent être très sombres et ressembler de loin à des mâles. Suivant les régions, le Vacher luisant peut être confondu avec d'autres espèces de blackbirds. On le distinguera surtout au plumage très brillant du mâle et à son habitude de fréquenter assidument les troupeaux de bovins et de chevaux.",Vacher luisant,27,027.Shiny_Cowbird,Vacher luisant
4,,,,,,,https://www.oiseaux.net/photos/raphael.jordan/images/id/vacher.bronze.rajo.1p.152.h.jpg,,,,,Vacher bronzé (Molothrus aeneus) est un oiseau qui appartient à la famille des Ictéridés.,Vacher bronzé,26,026.Bronzed_Cowbird,Vacher bronzé
5,"Vieillot, 1819",,  38 à 41 cm.,melancholicus,"
 ",Tyrannidés,https://www.oiseaux.net/photos/denis.chavigny/images/tyran.melancolique.dcha.0p.jpg,https://www.oiseaux.net/maps/images/tyran.melancolique.1.200.w.png,Passériformes,  32 à 43 g,  24 cm,Tyran mélancolique (Tyrannus melancholicus) est un oiseau qui appartient à la famille des Tyrannidés.,Tyran mélancolique,77,077.Tropical_Kingbird,Tyran mélancolique
6,"Linnaeus, 1758",,  34 cm.,crinitus,"
 ",Tyrannidés,https://www.oiseaux.net/photos/denis.chavigny/images/tyran.huppe.dcha.0p.jpg,,Passériformes,  27 à 40 g,  21 cm,Tyran huppé (Myiarchus crinitus) est un oiseau qui appartient à la famille des Tyrannidés.,Tyran huppé,38,038.Great_Crested_Flycatcher,Tyran huppé
7,,,,,,,https://www.oiseaux.net/photos/ricketdi/images/tyran.a.longue.queue.fori.1p.152.h.jpg,,,,,Tyran à longue queue (Tyrannus forficatus) est un oiseau qui appartient à la famille des Tyrannidés.,Tyran à longue queue,41,041.Scissor_tailed_Flycatcher,Tyran à longue queue
8,"Vieillot, 1809",,  - ,aedon,"
 ",Troglodytidés,https://www.oiseaux.net/photos/denis.chavigny/images/troglodyte.familier.dcha.0p.jpg,https://www.oiseaux.net/maps/images/troglodyte.familier.1.200.w.png,Passériformes,  - ,  13 cm,"C'est probablement la seule espèce qui puisse être confondue avec le Troglodyte mignon, bien que ce dernier soit plus petit, possède une queue plus courte, une livrée plus sombre et des parties inférieures plus nettement barrées de brun 
Chez le troglodyte familier, le capuchon et la nuque sont brun moyen, couleur qui devient plus chaude et plus roussâtre sur le dos et le croupion. Des barres tranversales foncées ornent le dos et les couvertures alaires. Les primaires et les secondaires portent une série de marques brunes et chamois en alternance, ce qui donne une apparence de barre lorsque l'aile est fermée. Les rectrices brun roussâtre sont marquées par une douzaine de barres transversales sombres qui sont particulièrement bien visibles lorsque la queue n'est pas étalée. Les côtés de la tête présentent une teinte gris-brun et un vague sourcil chamois grisâtre. La gorge, le menton et la poitrine sont blanc chamoisé, virant au chamois-roux sur la partie basse du ventre et sur les flancs. Les couvertures sous-caudales sont blanc grisé. L'iris est brun. La mandibule supérieure brun mat contraste avec la mandibule inférieure corne clair. Les pattes sont brun sombre. 
Les juvéniles présentent une poitrine mouchetée. Les barres sur les flancs sont moins évidentes.",Troglodyte familier,196,196.House_Wren,Troglodyte familier
9,"Say, 1822",,  23 cm.,obsoletus,"
 ",Troglodytidés,https://www.oiseaux.net/photos/serge.nicolle/images/troglodyte.des.rochers.seni.0p.jpg,,Passériformes,  15 à 18 g,  16 cm,Troglodyte des rochers (Salpinctes obsoletus) est un oiseau qui appartient à la famille des Troglodytidés.,Troglodyte des rochers,198,198.Rock_Wren,Troglodyte des rochers
10,"Lafresnaye, 1835",,  27 à 28 cm.,brunneicapillus,"
 ",Troglodytidés,https://www.oiseaux.net/photos/serge.nicolle/images/troglodyte.des.cactus.seni.0p.jpg,https://www.oiseaux.net/maps/images/troglodyte.des.cactus.1.200.w.png,Passériformes,  32 à 47 g,  19 cm,"En raison de sa grande taille, de ses ailes et sa queue fortement marquées, des bordures blanches de ses rectrices et des importantes taches noires qui maculent sa poitrine, il ne peut être confondu avec aucune autre espèce de troglodyte. On peut, à la rigueur, le prendre pour un Moqueur des armoises, mais ce dernier s'en distingue par son dos uni, son absence de marques aux rémiges et sa double barre alaire. 
Le troglodyte des cactus présente un capuchon brun-chocolat, absolument sans marque. La nuque affiche la même couleur avec cependant quelques stries blanches au centre des plumes. Le dos est plus gris-brun, avec des stries centrales plus larges et plus longues encadrées de noir. Ces stries se poursuivent sur le bas du dos, le croupion et les couvertures sus-caudales. Les tertiaires sont largement barrées d'une couleur qui varie du chamois clair au brun foncé. Les filets extérieurs des primaires et des secondaires présentent une alternance de zones chamois, blanches et noires, ce qui provoque l'émergence de 5 ou 6 barres bien visibles sur l'aile fermée. Les couvertures alaires portent des mouchetures chamois brunâtre. Les rectrices centrales sont recouvertes de barres noir brunâtre et gris-brun clair. Les 4 rectrices extérieures ont des bandes subterminales blanches. Le sourcil blanc part du bec et se poursuit jusqu'en arrière des couvertures auriculaires. Les couvertures auriculaires sont vaguement striées de gris et de noir. Le menton est blanc. La gorge et la poitrine portent de larges motifs noirs sur un fond blanchâtre. Les parties inférieures virent au chamois ou au chamois-orange sur le centre de la poitrine, le ventre, la zone anale et le dessous de la queue avec de petites taches noires. L'iris est brun rougeâtre foncé, le bec noirâtre terne avec une zone plus pâle à la base de la mandibule inférieure. Les pattes sont brunes ou brun-rosâtre. 
Les juvéniles diffèrent par leurs marques pectorales noires moins imposantes et par l'absence de stries blanches sur la nuque et le dos. L'orange-chamois de la zone anale est bien plus terne. L'iris est gris-brun trouble.",Troglodyte des cactus,194,194.Cactus_Wren,Troglodyte des cactus
11,"Latham, 1790",LC,  29 cm.,ludovicianus,"
 ",Troglodytidés,https://www.oiseaux.net/photos/serge.nicolle/images/troglodyte.de.caroline.seni.0p.jpg,,Passériformes,  18 à 22 g,  14 cm,"Chez les adultes, le capuchon et le dos sont brun éclatant devenant plus châtain sur le croupion et les sus-caudales. Les épaules et les grandes couvertures sont également brunes avec une série de petites taches blanches qui tapissent les couvertures primaires. Les secondaires portent des barres sombres sur l'ensemble des filets. Les primaires ne sont barrées que sur les filets extérieurs mais ces marques sont plus sombres et plus visibles. Les rectrices sont brunes, moins châtain que le croupion. Elles sont recouvertes par une vingtaine de barres transversales sombres qui s'étalent à espace régulier sur l'ensemble de la queue. L'œil est surmonté par un évident sourcil blanchâtre qui se poursuit jusqu'aux épaules. Ce trait oculaire est bordé de noir au-dessus et en dessous. Les oreillons sont mouchetés de gris. Le menton et la gorge sont gris sans tache, virant au chamois sur la poitrine et au chamois éclatant sur les flancs et le bas du ventre. Le dessous des ailes est chamois grisâtre. L'iris est brun-rouge. La mandibule supérieure est couleur citron avec une tache claire à la base. La mandibule inférieure est citron pâle. Les pattes sont couleur chair. 

Les juvéniles sont semblables aux adultes quoique légèrement plus pâles. Les couvertures alaires ont des terminaisons chamois. Les plumes de la zone anale sont ébouriffées. L'ensemble du plumage ne porte généralement pas de barres.",Troglodyte de Caroline,195,195.Carolina_Wren,Troglodyte de Caroline
12,"Audubon, 1827",LC,  18 cm.,bewickii,"
 ",Troglodytidés,https://www.oiseaux.net/photos/barry.kent.mackay/images/troglodyte.de.bewick.bkma.1p.jpg,,Passériformes,  8 à 12 g,  14 cm,"Chez les adultes, le capuchon, le dos et les épaules sont brun foncé éclatant, devenant plus roux sur le croupion et le bas du dos. Les plumes du bas du dos ont des taches blanches partiellement masquées. Les primaires et les secondaires sont gris-brun terne, les filets extérieurs portant de barres sombres qui sont particulièrement visibles sur l'aile fermée. Les tertiaires sont entièrement recouvertes de barres transversales. Les rectrices centrales portent une quinzaine de barres noires bien évidentes. Les plumes extérieures noirâtres ont une large bordure gris-blanc. Les lores sont grisâtres, un large sourcil chamois blanc se poursuit jusqu'en arrière de l'œil. La zone située en arrière de l'orbite est brun-roux, contrastant avec les mouchetures grisâtres des oreillons. Le menton et la gorge sont blanchâtres virant au gris-blanc sur la poitrine et au chamois-blanc sur le ventre. La partie inférieure des flancs est brune. Les iris sont bruns, le bec brun noirâtre avec une tache claire sur la mandibule inférieure. Les pattes sont brun sombre.
Les juvéniles ont un plumage moins foncé que celui des adultes. Les plumes des parties inférieures ont souvent de larges bordures sombres.",Troglodyte de Bewick,193,193.Bewick_Wren,Troglodyte de Bewick
13,"Audubon, 1839",,  - ,chlorurus,"
 ",Passerellidés,https://www.oiseaux.net/photos/serge.nicolle/images/tohi.a.queue.verte.seni.0p.jpg,https://www.oiseaux.net/maps/images/tohi.a.queue.verte.1.200.w.png,Passériformes,  - ,  18 cm,Tohi à queue verte (Pipilo chlorurus) est un oiseau qui appartient à la famille des Passerellidés.,Tohi à queue verte,148,148.Green_tailed_Towhee,Tohi à queue verte
14,"Latham, 1790",,  20 à 27 cm.,carolinensis,"
 ",Sittidés,https://www.oiseaux.net/photos/denis.chavigny/images/sittelle.a.poitrine.blanche.dcha.1p.jpg,,Passériformes,  18 à 30 g,  15 cm,Sittelle à poitrine blanche (Sitta carolinensis) est un oiseau qui appartient à la famille des Sittidés.,Sittelle à poitrine blanche,94,094.White_breasted_Nuthatch,Sittelle à poitrine blanche
15,"Gmelin, JF, 1789",,  22 à 26 cm.,purpureus,"
 ",Fringillidés,https://www.oiseaux.net/photos/denis.chavigny/images/roselin.pourpre.dcha.0p.jpg,,Passériformes,  18 à 31 g,  15 cm,Roselin pourpré (Haemorhous purpureus) est un oiseau qui appartient à la famille des Fringillidés.,Roselin pourpré,35,035.Purple_Finch,Roselin pourpré
16,"Vieillot, 1819",LC,  39 à 50 cm.,major,"
 ",Ictéridés,https://www.oiseaux.net/photos/serge.nicolle/images/quiscale.des.marais.seni.0p.jpg,,Passériformes,  93 à 239 g,  39 cm,"Les deux sexes sont dimorphiques. Chez l'adulte mâle, le bec est noir, les iris sont brun sombre (jaunâtres chez certaines sous-espèces). Le plumage est entièrement noir avec un lustre violet sur la tête. Les reflets deviennent bleu verdâtre sur la poitrine et sur le dos jusqu'à la queue. La zone anale est noirâtre et n'a pas de reflets irisés. Les ailes et la queue ont de vagues reflets verts. Les pattes et les pieds sont noirs. La femelle adulte affiche une couleur brun sombre sur la tête, les parties supérieures, les ailes et la queue. Les ailes et la queue peuvent présenter un léger lustre verdâtre. Les parties inférieures sont plus claires et l'œil est surmonté par un large sourcil chamois. Les joues sont parfois traversées par une vague strie plus foncée. La teinte chamois clair ou chamois-cannelle du dessous s'étend jusqu'aux pattes. La zone anale et les cuisses sont brun sombre. 
Les immatures mâles sont semblables aux adultes mais les zones irisées sont plus restreintes. La queue en forme de quille de bateau est plus courte. Les cuisses sont brunes et non pas noires. Les immatures femelles sont comme la femelle adulte mais leur dessus est plus pâle et leur dessous plus cannelle. Les juvéniles ressemblent aux femelles adultes mais ils ont une apparence entièrement cannelle et ils n'ont aucun reflet lustré. 
Les Quiscales des marais peuvent âtre confondus avec les Quiscales bronzés ou les Quiscales à longue queue.",Quiscale des marais,49,049.Boat_tailed_Grackle,Quiscale des marais
17,"Wagler, 1829",LC,  37 cm.,cyanocephalus,"
 ",Ictéridés,https://www.oiseaux.net/photos/serge.nicolle/images/quiscale.de.brewer.seni.0p.jpg,,Passériformes,  47 à 67 g,  21 à 23 cm,"Les sexes sont différents. Tout au long de l'année, le mâle adulte est entièrement noir, avec des reflets violets sur la tête et sur le cou. Le corps et les ailes affichent des plumes vert brillant. Il y a un contraste assez remarquable entre la couleur de la tête et du corps. Les plumes des ailes et de la queue sont bordées de brun. L'iris est jaune ou jaune clair. Le bec, les pattes et les pieds sont noirs. La femelle, de taille légèrement inférieure à son partenaire, a un aspect général gris-brun, hormis les ailes et la queue qui paraissent plus sombres. La tête et le cou ont une légère brillance violette, moins prononcée que chez le mâle. Le corps possède un faible lustre verdâtre. Les côtés de la tête paraissent plus pâles que le capuchon. L'œil est surmonté par un sourcil sombre. L'iris est brun foncé.

Les juvéniles ressemblent aux femelles adultes, mais ils sont plus pâles et leur plumage n'a aucun reflet. Le quiscale de Brewer peut être confondu avec trois autres ictéridés : le Quiscale bronzé (Quiscalus quiscula), le quiscale rouilleux (Euphagus carolinus) et le Vacher luisant (Molothrus bonariensis).",Quiscale de Brewer,9,009.Brewer_Blackbird,Quiscale de Brewer
18,"Sclater, PL, 1859",LC,  26 cm.,sordidulus,"
 ",Tyrannidés,https://www.oiseaux.net/photos/serge.nicolle/images/pioui.de.l.ouest.seni.1p.jpg,https://www.oiseaux.net/maps/images/pioui.de.l.ouest.1.200.w.png,Passériformes,  11 à 14 g,  16 cm,"Chez la race nominale, le sommet du capuchon est brun grisâtre foncé, les lores sont légèrement plus clairs. L'œil est entouré par un très fin anneau orbital qui est parfois absent. Les côtés de la tête, la nuque et les parties supérieures sont uniformément gris-brun. Les plumes des ailes sont sombres avec, sur les couvertures, des extrémités grisâtres qui forment 2 imperceptibles bandes alaires. 
Des liserés grisâtres sont également visibles sur les secondaires et sur les tertiaires. La queue a un teint mat. La gorge varie du gris clair au blanc, la poitrine et les flancs sont gris terne. Le ventre est plus pâle, avec une légère nuance jaunâtre. Les sous-caudales sont blanchâtres avec des centre gris-brun plus foncé. Le dessous des ailes est gris.
Les iris présentent une teinte brun foncé. La mandibule supérieure est noire, la mandibule inférieure est également noire mais avec une tache orange à la base. Les pattes sont noirâtres. 
La distinction est assez difficile à effectuer avec le pioui de l'est (Contopus virens) qui est généralement plus sombre et plus brun, possède des sous-alaires et des sous-caudales plus foncées ainsi qu'une tache plus claire sur la mandibule inférieure. 
Les sexes sont identiques mais la femelle paraît un peu plus petite. Les juvéniles ressemblent aux parents. Les différentes races se distinguent par la teinte plus ou moins foncée du dessus et par l'apport plus ou moins important de jaune sur les parties inférieures. La race peninsulae, qui niche au Mexique, est plus pâle, présente une fine bande pectorale grise, des liserés plus larges sur les rémiges. Elle a des ailes plus courtes et un bec plus allongé.",Pioui de l'Ouest,102,102.Western_Wood_Pewee,Pioui de l'Ouest
19,"Linnaeus, 1766",,  28 à 32 cm.,ludovicianus,"
 ",Laniidés,https://www.oiseaux.net/photos/barry.kent.mackay/images/pie-grieche.migratrice.bkma.2p.jpg,,Passériformes,  35 à 50 g,  22 cm,"Chez le mâle adulte, le masque facial couvre la base du bec et les lores. Il forme un petit filet noir juste au-dessus et en dessous de l'œil puis il s'élargit considérablement sur les couvertures auriculaires. Le fin sourcil blanchâtre est à peine visible. L'ensemble des parties supérieures est gris-ardoise de la nuque jusqu'au bas du dos, devenant plus pâle sur le croupion et les sus-caudales. Les scapulaires sont blancs formant un ""V"" très net et très contrasté sur le dos. La queue est noire avec des bordures blanches. Les rectrices ont des terminaisons blanches hormis la paire centrale. Les ailes sont noires avec une tache blanche au niveau des couvertures primaires. Les filets intérieurs des primaires, secondaires et tertiaires sont tachés de blanc. Les parties inférieures blanchâtres sont nuancées de gris pâle sur les flancs et affichent de légères vermiculures sur la poitrine. Le dessous de la queue est blanchâtre avec une pointe noire. 

Chez la femelle, le masque facial est brun. Le dessous est plus grisâtre et plus régulièrement vermiculé. Dans certaines régions, elle est plus petite et ses primaires sont plus brunes. Les juvéniles ont un masque brun foncé. Le capuchon est gris brunâtre, le manteau et le haut du dos sont gris-olive alors que le croupion et les sus-caudales sont gris terne ou couleur argile. L'ensemble des parties supérieures est plus ou moins vermiculé. Les scapulaires sont chamois clair, la queue est noire avec des terminaisons chamois cannelle. Les ailes sont noires et la tache des primaires est déjà perceptible. La poitrine et les flancs sont gris brunâtre avec d'abondantes vermiculures, le reste des parties inférieures est blanc. Des barres fuligineuses ornent souvent le côté de la gorge. Le dessous de la queue est entièrement blanc.",Pie-grièche migratrice,111,111.Loggerhead_Shrike,Pie-grièche migratrice
